mention_id,concept_expression,explain_text,expectation
23678_1_1_1_3_1_1,Tư_liệu lao_động,"những tài_sản hữu_hình có kết_cấu độc_lập , hoặc là một hệ_thống gồm nhiều bộ_phận tài_sản riêng_lẻ liên_kết với nhau để cùng thực_hiện một hay một_số chức_năng nhất_định mà nếu thiếu bất_kỳ một bộ_phận nào thì cả hệ_thống không_thể hoạt_động được , nếu thoả_mãn đồng_thời cả ba tiêu_chuẩn dưới đây thì được coi là tài_sản_cố_định :",0.744
15310_1_4_1_1_2_2,Trường_hợp đầu_vào,"chứng_từ điện_tử của hệ_thống thanh_toán nội_bộ hoặc song_phương của các tổ_chức tín_dụng đã được kiểm_tra hợp_lệ , kế_toán giao_dịch bổ_sung các nội_dung còn thiếu theo quy_định lập Lệnh thanh_toán ; Kế_toán kiểm_soát và người duyệt kiểm_tra lại các yếu_tố tương_tự như đối_với trường_hợp chứng_từ giấy để bảo_đảm tính chính_xác và ghi Mã_khoá bảo_mật của mình vào Lệnh thanh_toán để chuyển đi .",0.73
41048_1_2_1_1_4_5,Thành_viên Hội_đồng,các chuyên_gia và chuyên_viên quản_lý các Chương_trình .,0.734
113423_1_2_4_4_1_4,Một_ủy_viên Hội_đồng,đại_diện Ban_chấp_hành công_đoàn của đơn_vị sự_nghiệp công_lập quản_lý viên_chức ;,0.734
19301_1_1_7_1_0_0,Mục_tiêu của việc định_hướng các dòng di_dân,"nhằm phân_bố lại dân_cư và lao_động , sử_dụng tốt nhất các nguồn_lực , đáp_ứng yêu_cầu của quá_trình phát_triển .",0.757
32425_1_2_1_1_1_1,Tư_liệu lao_động,"những tài_sản hữu_hình có kết_cấu độc_lập , hoặc là một hệ_thống gồm nhiều bộ_phận tài_sản riêng_lẻ liên_kết với nhau để cùng thực_hiện một hay một_số chức_năng nhất_định mà nếu thiếu bất_kỳ một bộ_phận nào thì cả hệ_thống không_thể hoạt_động được , nếu thoả_mãn đồng_thời cả ba tiêu_chuẩn dưới đây thì được coi là tài_sản_cố_định :",0.724
23840_1_1_1_3_2_4,Giá cơ_sở của năm tương_ứng,mức giá dự_tính trong kế_hoạch phát_triển mỏ đã được phê_duyệt tương_ứng với năm thực_hiện .,0.708
19426_1_6_1_1_1_1,Công_ty có các đơn_vị trực_thuộc,"các nhà_máy , xí_nghiệp , các xưởng sản_xuất-kinh doanh ( sau đây gọi tắt là đơn_vị ) hạch_toán kinh_tế phụ_thuộc theo phân_cấp và uỷ_quyền của Giám_đốc Công_ty .",0.703
114211_1_1_1_2_13_1,Giá dịch_vụ nghĩa_trang,"toàn_bộ các chi_phí được tính đúng , tính đủ cho phần mộ cá_nhân và mức lợi_nhuận hợp_lý để thực_hiện dịch_vụ nghĩa_trang .",0.721
60935_1_1_1_3_1_1,Quy_định hành_chính,"những quy_định về cơ_chế , chính_sách , thủ_tục hành_chính liên_quan đến hoạt_động kinh_doanh và đời_sống nhân_dân , thuộc phạm_vi quản_lý của các cơ_quan hành_chính nhà_nước , do cơ_quan nhà_nước , người có thẩm_quyền ban_hành theo quy_định của pháp_luật .",0.974
99521_1_1_1_1_0_1,Chấp_thuận bổ_sung dự_toán_kinh_phí năm 2005 cho 05 sở - ngành thực_hiện khoán chi theo danh_mục của Sở Tài_chính trình tại Công_văn số 7131 / TC-HCSN ngày 01 tháng 9 năm 2005 ( đính kèm ) với tổng_số tiền,03 ( ba ) tỷ đồng .,0.761
7040_1_1_1_3_7_0,Vốn pháp_định,mức vốn tối_thiểu phải có theo quy_định củapháp luật để thành_lập doanh_nghiệp .,0.748
46751_1_1_1_4_29_1,Vốn điều_lệ,"tổng giá_trị tài_sản do các thành_viên đã góp hoặc cam_kết góp khi thành_lập công_ty trách_nhiệm hữu_hạn , công_ty hợp danh ; là tổng giá_trị mệnh_giá cổ_phần đã bán hoặc đã được đăng_ký mua khi thành_lập doanh_nghiệp đối_với công_ty cổ_phần .",0.736
23891_1_1_1_1_0_29,Nhóm doanh_nghiệp chiếm_thị_phần khống_chế,"các doanh_nghiệp có cùng hành_động gây hạn_chế cạnh_tranh , ảnh_hưởng trực_tiếp tới việc thâm_nhập thị_trường dịch_vụ đó của các doanh_nghiệp khác , thuộc các trường_hợp sau đây :",0.816
18755_1_1_1_4_0_1,Công_ty cổ_phần Điện_tử Biên_Hoà,"pháp_nhân theo pháp_luật Việt_Nam kể từ ngày được cấp đăng_ký kinh_doanh , thực_hiện hạch_toán kinh_tế độc_lập , được sử_dụng con_dấu riêng , được mở tài_khoản tại ngân_hàng theo quy_định của pháp_luật , hoạt_động theo Điều_lệ của Công_ty cổ_phần và Luật_Doanh_nghiệp .",0.747
