mention_id,concept_expression,explain_text,expectation
15068_1_6_2_15_0_3,Hệ_thống đặt giữ chỗ bằng máy_tính,"hệ_thống máy_tính cung_cấp thông_tin về lịch bay , tình_trạng chỗ của chuyến bay , giá cước vận_chuyển hàng không và thông_qua đó thực_hiện việc đặt chỗ trên chuyến bay .",0.845
95364_1_1_1_3_0_5,Chi_cục_trưởng,"người đứng đầu Chi_cục , chịu trách_nhiệm trước Giám_đốc Sở Nông_nghiệp và Phát_triển nông_thôn và trước pháp_luật về hoạt_động của Chi_cục và thực_hiện chức_năng , nhiệm_vụ , quyền_hạn được giao .",0.837
33347_1_2_1_10_0_57,Thời_hạn nộp lệ_phí trước_bạ,thời_hạn ghi trên thông_báo nộp lệ_phí trước_bạ .,0.824
10239_1_6_1_1_0_6,Giá thanh_toán công_trình,giá trúng_thầu và các điều_kiện được ghi trong hợp_đồng giữa chủ_dầu tư và các doanh_nghiệp xây_dựng .,0.828
26460_1_1_1_3_0_35,Cơ_quan cấp phép,"tên gọi chung của các cơ_quan có thẩm_quyền cấp , thu_hồi Giấy_phép QLCTNH .",0.832
95927_1_1_1_3_0_20,Điều_tra thống_kê,"hình_thức thu_thập dữ_liệu , thông_tin thống_kê về đối_tượng nghiên_cứu cụ_thể theo phương_pháp khoa_học , thống_nhất được xác_định trong phương_án điều_tra thống_kê cho mỗi lần điều_tra .",0.849
20295_1_1_1_1_0_54,Khu_vực giáp sông Lừ ở phía Tây_khu_đô_thị,khu_vực có cảnh_quan cây_xanh và môi_trường của Thành_phố phải được bảo_vệ .,0.832
19818_1_1_1_1_0_143,"Phí tham_quan danh_lam thắng_cảnh , di_tích lịch_sử , công_trình văn_hoá","khoản thu nhằm bù , đắp một phần hoặc toàn_bộ chi_phí về duy_tu , bảo_dưỡng , quản_lý đối_với danh_lam thắng_cảnh , di_tích lịch_sử , công_trình văn_hoá đó .",0.811
114557_1_1_1_2_0_10,Cơ_sở an_toàn dịch_bệnh động_vật thủy_sản,"cơ_sở sản_xuất giống , nuôi_trồng thủy_sản được xác_định không xảy ra ca bệnh đăng_ký an_toàn dịch_bệnh trong một khoảng thời_gian quy_định cho từng bệnh , từng loài động_vật thủy_sản và hoạt_động thú_y tại cơ_sở đó bảo_đảm kiểm_soát được dịch_bệnh .",0.861
122473_1_1_1_8_0_7,Số buổi tập tối_đa cho một chương_trình mới,10 buổi .,0.82
2711_1_1_1_1_0_31,"Uỷ_ban Nhân_dân các cấp , Thủ_trưởng các ngành , các cơ_quan và đơn_vị cơ_sở phải coi phòng , chống_lụt , bão","công_tác trọng_điểm của các cấp và ngành mình trong mùa mưa_bão , phải chịu trách_nhiệm trước nhân_dân và cấp trên theo chức_năng và thẩm_quyền của cấp , của ngành mình ; phải báo_cáo kịp_thời lên cấp trên về diễn_biến của thiên_tai và công_tác_phòng , chống_lụt , bão .",0.809
32588_1_1_1_3_0_15,Thả trôi,phương_pháp lợi_dụng thế_năng của đường dồn tàu để thả cho toa_xe hoặc cụm toa_xe tự chạy vào các đường trong bãi dồn ;,0.847
8839_1_1_1_1_0_26,Mọi tài_liệu,bản_sao bằng bất_kỳ cách sao nào đều phải được xác_nhận là sao y từ bản_gốc theo quy_định ở đoạn b ) sau đây thì mới được sử_dụng làm tài_liệu chính_thức trong quá_trình tiến_hành các thủ_tục liên_quan về sở công_nghiệp tại các cơ_quan có thẩm_quyền .,0.824
48248_1_2_1_2_0_12,Lưu_lượng từ 2 m3 / s đến 10 m3 / s phạm_vi vùng phụ_cận,10 m tính từ mép ngoài của móng công_trình ( kể_cả phần tiêu_năng ) .,0.801
121328_1_1_1_3_0_16,Chi_tiêu mới,"nhu_cầu chi ngân_sách nhà_nước để thực_hiện các nhiệm_vụ , hoạt_động , chế_độ , chính_sách mới cho từng lĩnh_vực được cấp có thẩm_quyền phê_duyệt thực_hiện , bao_gồm cả các nhiệm_vụ , hoạt_động , chế_độ , chính_sách đã ban_hành trước_đây nhưng chưa được bố_trí nguồn và cần tiếp_tục thực_hiện trong thời_gian 03 năm kế_hoạch .",0.837
